property_name,sale_price OMR,prop_location,prop_area SqM,prop_bathrooms,number_of_rooms,Ad_Type
ارض ف الحاجر الاولى كونر  مفتوحة ف  ثلاث اتجاهات  قابله للتمديد,11000,"Al Amarat, Muscat•",644,3,3,For Sale
ارض ف العامرات  العلاية اول خط من الشارع,17000,"Al Amarat, Muscat•",600,3,3,For Sale
home for sell,90000,"Barka, Al Batinah•",600,5,4,For Sale
أرض سكني العامرات العلاية اول خط عالشارع العام الرئيسي,18000,"Al Amarat, Muscat•",600,3,3,For Sale
أرض سكني العامرات العلاية اول خط عالشارع العام الرئيسي,10000,"Al Amarat, Muscat•",600,3,3,For Sale
ارض ف العامرات  مرتفعات  2,29000,"Al Amarat, Muscat•",500,3,3,For Sale
للبيع ارض سكنية في الانصب,190000,"Ansab, Muscat•",802,3,3,For Sale
للبيع ارض سكنية في المعبيلة الجنوبيه,86000,"Al Maabilah, Muscat•",845,3,3,For Sale
للبيع ارض سكنية في النهضه الرابعة,11000,"Al Amarat, Muscat•",600,3,3,For Sale
land for sell,60000,"Ibra, Al Sharqiya•",600,4,4,For Sale
للبيع ارض سكنية في النهضه,58000,"Al Amarat, Muscat•",627,3,3,For Sale
للبيع ارض سكنية في المعبيلة الجنوبيه,57000,"Al Maabilah, Muscat•",630,3,3,For Sale
للبيع ارض سكني تجاري في المعبيلة الجنوبية,135000,"Al Maabilah, Muscat•",400,3,3,For Sale
ارض زراعية كبيرة موقعها مميز في الكريب,95000,"Qurayyat, Muscat•",4,3,3,For Sale
land for sell,30000,"Barka, Al Batinah•",1,3,3,For Sale
للبيع ارض سكنية في الرميس بالقرب من البحر,15000,"Barka, Al Batinah•",399,3,3,For Sale
للبيع ارض في العامرات مدينة النهضه مربع 17,7000,"Al Amarat, Muscat•",600,3,3,For Sale
للبيع ارض في بوشر المسفاة الثالثهً,44000,"Bosher, Muscat•",600,3,3,For Sale
garage for sell,3000,"Al Maabilah, Muscat•",36,3,3,For Sale
ارض سكني للبيع في العامرات,8000,"Al Amarat, Muscat•",600,3,3,For Sale
للبيع ارض سكنية في بركاء,10000,"Barka, Al Batinah•",630,3,3,For Sale
للبيع ارض سكنية في ولاية بركاء,18000,"Barka, Al Batinah•",600,3,3,For Sale
للبيع ارض في بركاء,18000,"Barka, Al Batinah•",613,3,3,For Sale
للبيع ارض في بركاء الحرادي الساحل,14000,"Barka, Al Batinah•",600,3,3,For Sale
للبيع ارضين شبك في الدهس بركاء,17000,"Barka, Al Batinah•",600,3,3,For Sale
للبيع 3 ارضي شبك في الدهس بركاء,27000,"Barka, Al Batinah•",600,3,3,For Sale
للبيع ارض سكنية في بركاء,20000,"Barka, Al Batinah•",645,3,3,For Sale
للبيع ارض سكنية في بركاء,16000,"Barka, Al Batinah•",700,3,3,For Sale
home for sell,80000,"Al Seeb, Muscat•",320,6,5,For Sale
land  for sell,3000,"Al Jazur, Al Wusta•",921,3,3,For Sale
ولاية العامرات - الحشية الاولى قريبة جدا مدرسة الشوامخ و مستشفى المسرة,42000,"Al Amarat, Muscat•",1,3,3,For Sale
land for sell,13000,"Al Masn'a, Al Batinah•",1,3,3,For Sale
للبيع ارض زراعية في بوشر / أفلاج ، رقم القطعة 972  ، المساحة 71 متر,19000,"Bosher, Muscat•",71,3,3,For Sale
villa for sell,62000,"Al Seeb, Muscat•",300,5,5,For Sale
شقه للبيع العامرات,20000,"Al Amarat, Muscat•",81,2,2,For Sale
ارضين شبك في مرتفعات شياع,12000,"Sur, Al Sharqiya•",1,3,3,For Sale
ارضين شبك 1200 متر,12000,"Sur, Al Sharqiya•",1,3,3,For Sale
ارض في صور,10000,"Sur, Al Sharqiya•",567,3,3,For Sale
ارض في صور,2000,"Sur, Al Sharqiya•",600,3,3,For Sale
ارض في صور,18000,"Sur, Al Sharqiya•",519,3,3,For Sale
flat for sell,35000,"Ghala, Muscat•",70,2,1,For Sale
ارض في صور,7000,"Sur, Al Sharqiya•",600,3,3,For Sale
land for sell,190000,"Bidbid, Al Dakhiliya•",1,3,3,For Sale
2 Bedrooms Apartment For Sale in Oman,221000,"Sadah, Dhofar•",1,2,2,For Sale
home to sell,30000,"Al Buraimi, Al Buraimi•",600,6,6,For Sale
land for sell,17000,"Qurayyat, Muscat•",500,3,3,For Sale
carvan for sell,2000,"Salalah, Dhofar•",10,3,3,For Sale
land for sell,54000,"Al Maabilah, Muscat•",630,3,3,For Sale
land for sell,5000,"Al Amarat, Muscat•",600,3,3,For Sale
land for sell,9000,"Sohar, Al Batinah•",600,3,3,For Sale
land for sell,33000,"Saham, Al Batinah•",2,3,3,For Sale
carvan for sell,1000,"Ibri, Al Dhahirah•",12,3,3,For Sale
home for sell,44000,"Sohar, Al Batinah•",615,5,3,For Sale
villa for sell,52000,"Barka, Al Batinah•",659,5,4,For Sale
للبيع ارض سكنية في النهضه,15000,"Al Amarat, Muscat•",750,3,3,For Sale
للبيع ارض سكني تجاري في روي,225000,"Ruwi, Muscat•",529,3,3,For Sale
ارض سكنية في الحاجر للبيع,18000,"Al Amarat, Muscat•",600,3,3,For Sale
ارض سكنية للبيع في مرتفعات بوشر,195000,"Bosher, Muscat•",975,3,3,For Sale
ارض سكنية للبيع في النهضة,11000,"Al Amarat, Muscat•",600,3,3,For Sale
ارض سكنية للبيع في بوشر,136000,"Bosher, Muscat•",600,3,3,For Sale
ارض سكنية في المعبيلة للبيع,37000,"Al Maabilah, Muscat•",300,3,3,For Sale
ارض زراعية جميلة في العقدة,55000,"Barka, Al Batinah•",4,3,3,For Sale
للبيع ارض سكنية في بركاء,150000,"Barka, Al Batinah•",3,3,3,For Sale
ارض سكني تجاري في المعبيلة للبيع,150000,"Al Maabilah, Muscat•",400,3,3,For Sale
ارض سكنية في بوشر,195000,"Bosher, Muscat•",975,3,3,For Sale
للبيع ارض سكنية مدينة النهضه الرابعه,11000,"Al Amarat, Muscat•",600,3,3,For Sale
ارض سكنية في الشخاطيط,35000,"Al Maabilah, Muscat•",600,3,3,For Sale
للبيع ارض سكنيه في مدينة النهضه الثانيه,15000,"Al Amarat, Muscat•",600,3,3,For Sale
ارض سكنية في مدينة النهضه للبيع,15000,"Al Amarat, Muscat•",600,3,3,For Sale
ارض سكنية في بوشر للبيع,270000,"Bosher, Muscat•",1,3,3,For Sale
ارض للبيع في المسفاة,23000,"Misfah, Muscat•",300,3,3,For Sale
شقق للبيع في بوشر المربع التجاري مقابل عمان مول,43000,"Bosher, Muscat•",104,3,2,For Sale
ارض للبيع في بركاء الفليج 2,28000,"Barka, Al Batinah•",600,3,3,For Sale
ارض للبيع في بدية منطقة الغبي2,3000,"Bidiya, Al Sharqiya•",600,3,3,For Sale
مبنى سكني تجاري للبيع في نزوى منطقة حي العين,100000,"Nizwa, Al Dakhiliya•",300,3,3,For Sale
ارض للبيع في محوت,170000,"Mahut, Al Wusta•",8,3,3,For Sale
شقة للبيع في الحيل,30000,"Al Hail, Muscat•",80,2,1,For Sale
منزل للبيع في المعبيلة 5/1 خلف نيستو وقريب من مسقط مول,63000,"Al Maabilah, Muscat•",270,5,5,For Sale
land for sell,2000,"Saham, Al Batinah•",600,3,3,For Sale
land for sell,21000,"Saham, Al Batinah•",1,3,3,For Sale
ارض قريبة من الشارع العام,26000,"Sur, Al Sharqiya•",989,3,3,For Sale
2 land for sell,12000,"Sohar, Al Batinah•",300,3,3,For Sale
ارض سكني تجاري في صور,4000,"Sur, Al Sharqiya•",300,3,3,For Sale
flat for sell,37000,"Azaiba, Muscat•",87,2,2,For Sale
ارض في ولاية صور,2000,"Sur, Al Sharqiya•",663,3,3,For Sale
للبيع ارض في صور الجميلة,2000,"Sur, Al Sharqiya•",600,3,3,For Sale
للبيع أرض في صور,2000,"Sur, Al Sharqiya•",700,3,3,For Sale
للبيع أرض في الجنز,3000,"Sur, Al Sharqiya•",600,3,3,For Sale
ارض للبيع في صور,2000,"Sur, Al Sharqiya•",600,3,3,For Sale
للبيع بناية سكني تجاري ف البريمي موقع ممتاز ( ارض الجو ),350000,"Al Buraimi, Al Buraimi•",2,3,3,For Sale
فيلا حديثه بتصميم عصري,41000,"Suwaiq, Al Batinah•",230,5,4,For Sale
land for sell,13000,"Al Amarat, Muscat•",600,3,3,For Sale
land for sell,61000,"Bidbid, Al Dakhiliya•",1,3,3,For Sale
land for sell,19000,"Al Khaboura, Al Batinah•",2,3,3,For Sale
العامرات جحلوت,3000,"Al Amarat, Muscat•",600,3,3,For Sale
المصنعه النهضه جنوب المرحله الثانيه,3000,"Al Masn'a, Al Batinah•",611,3,3,For Sale
العامرات الحشيه الثانيه,4000,"Al Amarat, Muscat•",600,3,3,For Sale
ثلاث اراضي شبك ولاية بركاء,19000,"Barka, Al Batinah•",1,3,3,For Sale
العامرات مربع18,12000,"Al Amarat, Muscat•",600,3,3,For Sale
المصنعه النهضه جنوب المرحله الثانيه,2000,"Al Masn'a, Al Batinah•",611,3,3,For Sale
land for sell,15000,"Barka, Al Batinah•",1,3,3,For Sale
المصنعه النهضه جنوب المرحله الثالثة,2000,"Barka, Al Batinah•",611,3,3,For Sale
المصنعه النهضه جنوب المرحله الثالثه,2000,"Al Masn'a, Al Batinah•",611,3,3,For Sale
العامرات الحاجر 3,4000,"Al Amarat, Muscat•",600,3,3,For Sale
المضيبي مخطط المضيبي 19,2000,"Al Mudaibi, Al Sharqiya•",600,3,3,For Sale
المصنعه النهضه جنوب,2000,"Barka, Al Batinah•",611,3,3,For Sale
المصنعه النهضه جنوب المرحله الثانيه,2000,"Al Masn'a, Al Batinah•",600,3,3,For Sale
المصنعه النهضه جنوب المرحله الثانيه,2000,"Al Masn'a, Al Batinah•",613,3,3,For Sale
العامرات مدينه النهضه,11000,"Al Amarat, Muscat•",600,3,3,For Sale
ولاية المضيبي,2000,"Al Mudaibi, Al Sharqiya•",780,3,3,For Sale
العامرات مربع14/2,7000,"Al Amarat, Muscat•",600,3,3,For Sale
العامرات جحلوت,3000,"Al Amarat, Muscat•",600,3,3,For Sale
land for sell,8000,"Ibra, Al Sharqiya•",668,3,3,For Sale
محوت الجوبه الارض فرصه قريب من الدوار والمحلات التجاريه,1000,"Mahut, Al Wusta•",600,3,3,For Sale
ارض سكنية في المعبيله العاشرة للبيع,50000,"Al Maabilah, Muscat•",600,3,3,For Sale
ارض سكنية في المعبيلة للبيع,50000,"Al Maabilah, Muscat•",600,3,3,For Sale
للبيع ارض سكني تجاري في المعبيله,150000,"Al Maabilah, Muscat•",750,3,3,For Sale
land for sell,2000,"Al Mudaibi, Al Sharqiya•",3,3,3,For Sale
للبيع ارض سكنية في مدينة النهضة,35000,"Al Amarat, Muscat•",600,3,3,For Sale
ارض سكنية في العامرات الثانيه,33000,"Al Amarat, Muscat•",500,3,3,For Sale
للبيع ارض سكنية في العامرات التاسعة,43000,"Al Amarat, Muscat•",600,3,3,For Sale
land for sell,25000,"Saham, Al Batinah•",4,3,3,For Sale
land for sell,32000,"Bosher, Muscat•",300,3,3,For Sale
villa for sell,72000,"Al Maabilah, Muscat•",401,5,5,For Sale
villa for sell,48000,"Al Khaboura, Al Batinah•",640,6,6,For Sale
شقة للبيع في بوشر شارع الكليات بجانب مستشفى مسقط الخاص,31000,"Bosher, Muscat•",60,2,1,For Sale
barber shop for sell,5000,"Sohar, Al Batinah•",600,3,3,For Sale
land for sell,32000,"Al Masn'a, Al Batinah•",2,3,3,For Sale
land for sell,8000,"Al Masn'a, Al Batinah•",617,3,3,For Sale
land for sell,110000,"Manah, Al Dakhiliya•",6,3,3,For Sale
flat for sell,26000,"Al Hail, Muscat•",78,3,2,For Sale
land for sell,43000,"Barka, Al Batinah•",1,3,3,For Sale
villa for sell,51000,"Barka, Al Batinah•",300,6,4,For Sale
للبيع ارض سكنية في العامرات,33000,"Al Amarat, Muscat•",500,3,3,For Sale
للبيع ارضين شبك سكني تجاري في بركاء البلة,132000,"Barka, Al Batinah•",750,3,3,For Sale
إعلان أراضي المسفاة,44000,"Misfah, Muscat•",600,3,3,For Sale
للبيع ارض سكنية في الانصب,73000,"Ansab, Muscat•",300,3,3,For Sale
للبيع ارض سكنية في المعبيلة الجنوبية,60000,"Al Maabilah, Muscat•",640,3,3,For Sale
للبيع ارض سكنية في بوشر,320000,"Bosher, Muscat•",1,3,3,For Sale
ارض سكنية للبيع في الفليج,32000,"Barka, Al Batinah•",617,3,3,For Sale
للبيع ارض سياحيه في ابو النخيل بركاء,160000,"Barka, Al Batinah•",2,3,3,For Sale
للبيع ارض سكني تجاري في الغبرة,210000,"Al Ghubrah, Muscat•",551,3,3,For Sale
ارض سكنية للبيع في العامرات,42000,"Al Amarat, Muscat•",600,3,3,For Sale
ارض سكنية للبيع في العوابي,55000,"Al 'Awabi, Al Batinah•",600,3,3,For Sale
للبيع ارض سكنية في العامرات,18000,"Al Amarat, Muscat•",600,3,3,For Sale
* بركاء - الفليج المعمورة,13000,"Barka, Al Batinah•",663,3,3,For Sale
جزء من توين فله للبيع بركاء | الفليج,65000,"Barka, Al Batinah•",297,7,5,For Sale
للبيع شقق في ولاية بوشر,48000,"Bosher, Muscat•",125,3,3,For Sale
شقق للبيع في السيب,41000,"Al Khoud, Muscat•",113,4,2,For Sale
للبيع ارض سكنية في العامرات الثامنة,42000,"Al Amarat, Muscat•",600,3,3,For Sale
land for sell,25000,"Ibri, Al Dhahirah•",603,3,3,For Sale
land for sell,15000,"Yiti, Muscat•",600,3,3,For Sale
shop for sell,5000,"Al Masn'a, Al Batinah•",20,3,3,For Sale
land for sell,23000,"Sohar, Al Batinah•",600,3,3,For Sale
land for sell,10000,"Al Rustaq, Al Batinah•",611,3,3,For Sale
للبيع ارض سكنية في العامرات / مرتفعات 8/1,25000,"Al Amarat, Muscat•",330,3,3,For Sale
للبيع أرض سكني تجاري في ولاية العامرات / عدن,29000,"Al Amarat, Muscat•",400,3,3,For Sale
العامرات- مدينة النهضة مربع 18 ثاني قطعة من الشارع الرئيسي لمربع 18,12000,"Al Amarat, Muscat•",600,3,3,For Sale
العامرات مدينة النهضة مربع 14/1 من ارخص الاراضي قريبه من البيوت والخدم,8000,"Al Amarat, Muscat•",600,3,3,For Sale
السويق البارده من ارخص الأراضي عرضا في السوق,2000,"Suwaiq, Al Batinah•",600,3,3,For Sale
العامرات الحشيه الارض فرصه رابع خط من الشارع القاروقريب من منازل جاهزة,6000,"Al Amarat, Muscat•",600,3,3,For Sale
land for sell,13000,"Barka, Al Batinah•",622,3,3,For Sale
ارض للبيع في نزوى خلف جامعة العلوم التطبيقية,28000,"Nizwa, Al Dakhiliya•",900,3,3,For Sale
العامرات مربع17 اول خط من الشارع القارالرئيسي وقريب من منازل جاهزه,12000,"Al Amarat, Muscat•",600,3,3,For Sale
العامرات الامتداد الأول,9000,"Al Amarat, Muscat•",600,3,3,For Sale
العامرات مربع17 الارض قريب من النفق الجديد و مخطط العهد,10000,"Al Amarat, Muscat•",600,3,3,For Sale
العامرات الامتداد الأول الارض ممتازه جدا قريب من الشارع القار,7000,"Al Amarat, Muscat•",600,3,3,For Sale
العامرات جحلوت سابقا الارض ملاصقه لمنزل جاهز,4000,"Al Amarat, Muscat•",600,3,3,For Sale
بركاء الفليج المعمورة الارض فرصة قريب من بيوت الشعبيه والمسجد,16000,"Barka, Al Batinah•",630,3,3,For Sale
العامرات جحلوت سابقا بعي حاليا,4000,"Al Amarat, Muscat•",660,3,3,For Sale
land for sell,12000,"Al Amarat, Muscat•",600,3,3,For Sale
ارضين شبك المصنعه النهضه جنوب المرحله الثالثه,6000,"Al Masn'a, Al Batinah•",1,3,3,For Sale
المصنعه النهضه جنوب المرحله الثانيه موقع ممتازمستوي قريب شارع خط الغاز,2000,"Al Masn'a, Al Batinah•",618,3,3,For Sale
المصنعه الملده لارض اول خط من الشارع القارالمؤدي الي منتجع بارسيلوا,9000,"Al Masn'a, Al Batinah•",630,3,3,For Sale
العامرات الحشيه الثانيه الارض ثالث خط من الشارع المزمع إقامته مزدوج,4000,"Al Amarat, Muscat•",642,3,3,For Sale
بركاء - الفليج المعمورة,11000,"Barka, Al Batinah•",690,3,3,For Sale
العامرات الحشيه الثانيه فرصه من ذهب موقع رهيب وقريب منازل قائمه,4000,"Al Amarat, Muscat•",620,3,3,For Sale
العامرات جحلوت الأولى كل الخدمات متوفره سارع بالحجز,5000,"Al Amarat, Muscat•",612,3,3,For Sale
العامرات- سمكت فرصة لامتلاك ارض في سمكت بمساحة نادرة 1000 متر,6000,"Al Amarat, Muscat•",1,3,3,For Sale
villa for sell,53000,"Al Amarat, Muscat•",600,3,3,For Sale
land for sell,54000,"Al Seeb, Muscat•",600,3,3,For Sale
shop for sell,8000,"Al Amarat, Muscat•",100,3,3,For Sale
ارض سكنية للبيع في بركاء,13000,"Barka, Al Batinah•",605,3,3,For Sale
sell land,9000,"Izki, Al Dakhiliya•",602,3,3,For Sale
"Staircase, Broadband Internet, Elevator, Garden, Garage Parking",244000,"Bosher, Muscat•",601,6,4,For Sale
10 shop for sell,145000,"Al Amarat, Muscat•",420,3,3,For Sale
فيلا جاهزة طابق ارضي في صحم (المرفع مربع 308),36000,"Saham, Al Batinah•",214,3,3,For Sale
"Gym, Dry Clean, School, Hospital, Bank / ATM, Mosque, Supermarket, Res",69000,"Ibra, Al Sharqiya•",1,3,3,For Sale
VILLA FOR SALE فيلا للبيع,72000,"Al Maabilah, Muscat•",401,5,5,For Sale
للبيع ارض في بركاء الفليج,13000,"Barka, Al Batinah•",663,3,3,For Sale
للبيع محل تجاري في الأنصب موقع مميز منطقة تجارية حيوية,50000,"Ansab, Muscat•",33,3,3,For Sale
للبيع ارض في العامرات التاسعه,36000,"Al Amarat, Muscat•",600,3,3,For Sale
فيلا للبيع من اصل توين فيلا في العامرات الثامنة,68000,"Al Amarat, Muscat•",300,5,3,For Sale
للبيع ارض في العامرات 11,15000,"Al Amarat, Muscat•",600,3,3,For Sale
فيلا راقية للبيع في العامرات مرتفعات الثانية,199000,"Al Amarat, Muscat•",600,7,6,For Sale
مخطط الساحل ارض للبيع في قريات,10000,"Qurayyat, Muscat•",657,3,3,For Sale
أرض زراعية في ازكي للبيع,8000,"Izki, Al Dakhiliya•",1,3,3,For Sale
منزل للبيع في العامرات الثالثة,47000,"Al Amarat, Muscat•",300,7,6,For Sale
شقتين للبيع في العامرات الخامسة,60000,"Al Amarat, Muscat•",120,3,2,For Sale
فيلا للبيع من أصلً توين في العامرات الخامسة,63000,"Al Amarat, Muscat•",300,7,6,For Sale
فيلا للبيع في المعبيلة الجنوبية,150000,"Al Maabilah, Muscat•",638,4,5,For Sale
للبيع بيت عربي صغير في العامرات,45000,"Al Amarat, Muscat•",262,4,2,For Sale
فيلا للبيع او للإيجار السابعه العامرات,60000,"Al Amarat, Muscat•",300,3,3,For Sale
للبيع بيت مستقل في مدينة النهضه,58000,"Al Amarat, Muscat•",600,5,5,For Sale
للبيع ارض في المعبيلة الثامنه قريب جامع بدر الدين الخليلي,46000,"Al Maabilah, Muscat•",600,3,3,For Sale
ارض للبيع في المعبيلة,43000,"Al Maabilah, Muscat•",600,3,3,For Sale
ارض للبيع في المعبيلة الثامنه,54000,"Al Maabilah, Muscat•",630,3,3,For Sale
للبيع ارض صناعية في نزوى,35000,"Nizwa, Al Dakhiliya•",1,3,3,For Sale
ارض سكنية للبيع العامرات مدينة النهضه,18000,"Al Amarat, Muscat•",600,3,3,For Sale
ارض سكنية للبيع في العامرات مدينة النهضه,16000,"Al Amarat, Muscat•",603,3,3,For Sale
ارض سكنية في العامرات المنظرية للبيع,4000,"Al Amarat, Muscat•",600,3,3,For Sale
ارض سكنية في العامرات سمكت,4000,"Al Amarat, Muscat•",700,3,3,For Sale
ارض سكنية للبيع في العامرات الحاجر,4000,"Al Amarat, Muscat•",600,3,3,For Sale
ارض سكني للبيع في العامرات مدينة النهضه,8000,"Al Amarat, Muscat•",600,3,3,For Sale
ارض سكنية للبيع في عبري,3000,"Ibri, Al Dhahirah•",767,3,3,For Sale
للبيع فندق براند عالمي (بارك سايد بلازا),10000,"Ghala, Muscat•",800,3,3,For Sale
للبيع ارض في ازكي,4000,"Izki, Al Dakhiliya•",645,3,3,For Sale
للبيع ارض سكنية في العامرات مدينة النهضه,12000,"Al Amarat, Muscat•",600,3,3,For Sale
المصنعه برج الـ خميس الارض قريبه الشارع القارومقابل استراحه الراجحي,3000,"Al Masn'a, Al Batinah•",600,3,3,For Sale
فرصة ذهبية للمستثمرين والراغبين في البناء للبيع ارض سكنية في العامرات,15000,"Al Amarat, Muscat•",600,3,3,For Sale
ارضين شبك زراعيه في بركاء مخطط البله فرصه لإقامة استراحه عائليه,16000,"Barka, Al Batinah•",1,3,3,For Sale
"Heating, Central Air Conditioning, Air Conditioning, Double Glazed Win",55000,"Nizwa, Al Dakhiliya•",670,6,6,For Sale
المصنعه الملده الثامنه موقع ممتازخلف مركزشرطة المصنعه,4000,"Al Masn'a, Al Batinah•",616,3,3,For Sale
للبيع ارض سكنية في العامرات مدينة النهضه,18000,"Al Amarat, Muscat•",600,3,3,For Sale
للبيع ارض سكني في العامرات,17000,"Al Amarat, Muscat•",600,3,3,For Sale
العامرات مربع 18,7000,"Al Amarat, Muscat•",600,3,3,For Sale
ولاية بركاء الفليج المعمورة,12000,"Barka, Al Batinah•",690,3,3,For Sale
للبيع ارض سكنية في النهضة العامرات مربع 14,14000,"Al Amarat, Muscat•",600,3,3,For Sale
farm and shops for sell togther,58000,"Al Qabil, Al Sharqiya•",6,3,3,For Sale
العامرات- بعي كورنر في وتبعد 250 متر من الشارع القار,3000,"Al Amarat, Muscat•",600,3,3,For Sale
ارض سكنية في العامرات الثانيه,45000,"Al Amarat, Muscat•",613,3,3,For Sale
ولاية بركاء القريحة الثامنة,5000,"Barka, Al Batinah•",600,3,3,For Sale
بركاء القريحه الجديده قريب من عدة استراحات مثل استراحه المزن والفا,6000,"Barka, Al Batinah•",648,3,3,For Sale
ارض سكنية في مدينة النهضه,46000,"Al Amarat, Muscat•",600,3,3,For Sale
"Pharmacy, Supermarket, Bank / ATM, Mall / Shopping Center, Parking, Re",11000,"Barka, Al Batinah•",600,3,3,For Sale
ارض سكنية سوبر كورنر في المعبيلة الجنوبية,68000,"Al Maabilah, Muscat•",707,3,3,For Sale
ارض سكني تجاري في المعبيلة الصناعية للبيع,150000,"Al Maabilah, Muscat•",750,3,3,For Sale
العامرات الامتداد الأول,7000,"Al Amarat, Muscat•",600,3,3,For Sale
ارض سكنية في المعبيله الجنوبية سوبر كورنر تنفع لعمل توين فيلا,60000,"Al Maabilah, Muscat•",640,3,3,For Sale
ارض سكنية جميله موقعها مميز في بوشر,220000,"Bosher, Muscat•",1,3,3,For Sale
land in barka,25000,"Barka, Al Batinah•",600,3,3,For Sale
ارض سكنية جميله موقعها مميز في الانصب,140000,"Ansab, Muscat•",600,3,3,For Sale
ارض سكنية في فلج الشام,90000,"Ansab, Muscat•",600,3,3,For Sale
big home in massana for sell,55000,"Al Masn'a, Al Batinah•",1,5,6,For Sale
ارض سكنية في بوشر السادسة,90000,"Bosher, Muscat•",500,3,3,For Sale
ارض سكنية في مرتفعات العامرات للبيع,33000,"Al Amarat, Muscat•",600,3,3,For Sale
ارض للبيع في العامرات الحشية,7000,"Al Amarat, Muscat•",626,3,3,For Sale
"Bus Station, Mosque, School, Gym, Dry Clean, Bank / ATM, Hospital, Pha",6000,"Salalah, Dhofar•",2,3,3,For Sale
بركاء القريحه السادسه مزرعة الطأووس,4000,"Barka, Al Batinah•",609,3,3,For Sale
العامرات جحلوت الاولى لارض فرصه رابع خط من الشارع القار الرئيسي,6000,"Al Amarat, Muscat•",600,3,3,For Sale
العامرات جحلوت الاولى الارض فرصه ملاصقه لمنزل جاهزوثاني,5000,"Al Amarat, Muscat•",600,3,3,For Sale
العامرات مربع 18,11000,"Al Amarat, Muscat•",600,3,3,For Sale
free land in smail,22000,"Sumail, Al Dakhiliya•",600,3,3,For Sale
بركاء الحفري الخامسه الارض فرصه ملاصقه مخطط الدهس وقريب من منازل جاهزة,6000,"Barka, Al Batinah•",605,3,3,For Sale
محوت مخطط حج10,1000,"Mahut, Al Wusta•",600,3,3,For Sale
تجاريه ولاية ثمريت المطهفه,4000,"Thumrait, Dhofar•",400,3,3,For Sale
العامرات الحشيه الثانيه,5000,"Al Amarat, Muscat•",600,3,3,For Sale
شقة للبيع بالحيل الجنوبية,26000,"Al Hail, Muscat•",78,3,2,For Sale
"Jacuzzi, Central Air Conditioning, Balcony, Laundry Room, Installed Ki",26000,"Ghala, Muscat•",60,2,1,For Sale
استراحة في موقع مميز جدًا للبيع,78000,"Barka, Al Batinah•",150,5,2,For Sale
للبيع ارض في السيفة وفيها بيت قديم قابل الاستفادة والتطوري,87000,"Al Sifah, Muscat•",347,3,3,For Sale
