property_name,sale_price OMR,prop_location,prop_area SqM,prop_bathrooms,number_of_rooms,Ad_Type
Furnished 3-Bedroom Lakefront Villa for Sale in Hawana Salalah,249000,"Salalah, Dhofar•",573,3,3,For Sale
Luxury Apartment|Mouj Muscat |Freehold Ownership|Permanent Residency,125000,"The Wave (Almouj), Muscat•",110,2,1,For Sale
5 BR Spacious Villa in Azaiba Nearby Amenities,197000,"Azaiba, Muscat•",600,4,5,For Sale
Two Bedroom Seaview Apartment at Mandarin Oriental Muscat,405000,"Qurum, Muscat•",131,3,2,For Sale
Villa for Sale (Garden) - Sea View,517000,"Yiti, Muscat•",506,6,4,For Sale
Exclusive Furnished 3-Bedroom Villa for Sale in Hawana Salalah,254000,"Salalah, Dhofar•",610,3,3,For Sale
ارخص فیلا قید الانشاء | تقسیط | موج مسقط | 5 غرف نوم | طابقین,573000,"The Wave (Almouj), Muscat•",549,6,5,For Sale
"Luxury Sea View Apartment for Sale – Juman 2, Al Mouj, Muscat",215000,"The Wave (Almouj), Muscat•",145,3,2,For Sale
3 + 1 Fully Furnished Villa for Sale in Al Khoud with Garden & Pool,150000,"Al Khoud, Muscat•",768,4,3,For Sale
‎فيلا جديده راقيه للبيع في المعبيلة الثالثة,120000,"Al Maabilah, Muscat•",408,6,6,For Sale
أرض للبيع خمس اراضي زراعية مساحة كل منهن 16800 متر مربع في ولاية بركاء,350000,"Barka, Al Batinah•",16,3,3,For Sale
أرض للبيع او الاستثمار بناية سكنيه تجارية,250000,"Al Buraimi, Al Buraimi•",547,3,3,For Sale
ارض للبيع سكني تجاري في غلاء - Land for sale in Ghala,500000,"Ghala, Muscat•",2,3,3,For Sale
فيلا راقيه للبيع في الخوض السادسه,285000,"Al Khoud, Muscat•",614,10,9,For Sale
الأرض للبيع مساحه ٢١٠٨ م,50000,"Barka, Al Batinah•",2,3,3,For Sale
"شقة للبيع في جبل سيفة  Apartment for Sale with Direct sea view, Sifah",95000,"Al Sifah, Muscat•",124,2,2,For Sale
"ADVS1501** New Villa, Modern And Well Designed 4 BHK Villa For Sale in",98000,"Al Amarat, Muscat•",195,6,4,For Sale
2Bedroom Lake View Apartment for Sale in Hawana Salalah,85000,"Salalah, Dhofar•",120,2,2,For Sale
Furnished 1-Bedroom Apartment for Sale in Hawana Salalah – Pool View,50000,"Salalah, Dhofar•",55,1,1,For Sale
2BHK Penthouse Apartment with Stunning View – For Sale in Jebel Sifah,95000,"Al Sifah, Muscat•",129,2,2,For Sale
"فيلا للبيع في مدينة السلطان هيثم | Villa For Sale, Sultan Haitham City",175000,"Al Seeb, Muscat•",333,3,4,For Sale
شقق للبيع في مدينة السلطان هيثم  Apartments for Sale in Sultan Haitham,53000,"Sultan Haitham City, Muscat•",67,1,1,For Sale
2-Bedroom Apartment in Jebel Sifah   شقة غرفتين للبيع في جبل سيفة,73000,"Al Sifah, Muscat•",120,2,2,For Sale
Farm 2+1 Bedrooms in Jebel Sifah | شاليه غرفتين + عاملة في جبل سيفة,170000,"Al Sifah, Muscat•",140,3,2,For Sale
"Live in Style: 2BR + Maid’s Room Apartment, Jebel Sifah",110000,"Al Sifah, Muscat•",124,2,2,For Sale
"Sifah Farm 2+1 Bed for sale, Jebel Sifah | شاليه للبيع في جبل سيفة",190000,"Al Sifah, Muscat•",990,3,2,For Sale
فيلا غرفتين للبيع في هوانا صلالة | Villa 2BHK in Hawana Salalah,165000,"Salalah, Dhofar•",131,2,2,For Sale
2Bedroom Duplex Villa For Sale – Hawana Salalah,135000,"Salalah, Dhofar•",124,2,2,For Sale
Furnished 4-Bedroom Twin-Storey Villa for Sale in Jebel Sifah,335000,"Al Sifah, Muscat•",344,4,4,For Sale
Fully Furnished 2-Bedroom Villa for Sale in Hawana salalah,160000,"Salalah, Dhofar•",131,2,2,For Sale
Apartment for sale in Muscat- شقة للبيع في مسقط,87000,"Yiti, Muscat•",79,2,1,For Sale
Courtyard Villa for Sale -  فيلا للبيع,238000,"Yiti, Muscat•",252,5,3,For Sale
Apartment for sale with 3 bedrooms- شقة للبيع بثلاث غرف,220000,"Yiti, Muscat•",164,4,3,For Sale
Apartment for sale with 2-Bedrooms شقة للبيع بغرفتين,132000,"Yiti, Muscat•",122,3,2,For Sale
Villa in Muscat for Sale فيلا للبيع في مسقط,468000,"Yiti, Muscat•",459,6,4,For Sale
Townhouse for sale in Sultan Haitham تاون هاوس للبيع في مدينة السلطان,111000,"Sultan Haitham City, Muscat•",194,3,3,For Sale
2 Bedrooms Sea View Villa Jebel Sifah | فيلا غرفتين على البحر جبل سيفة,265000,"Al Sifah, Muscat•",129,2,2,For Sale
Marina-Facing 3-Bedroom Apartment for Sale – Al Mouj Muscat,240000,"The Wave (Almouj), Muscat•",195,3,3,For Sale
Park View| Private Garden| Luxurious Amara 5BHK Villa in Jinan Island,714000,"The Wave (Almouj), Muscat•",455,6,5,For Sale
توين فيلا بموقع ممتاز للبيع في العامرات مرتفعات 2,82000,"Al Amarat, Muscat•",338,7,6,For Sale
تملك شقتك الدوبلكيس من طابقين ف العذيبه بالاقساط علي 48 شهر بدون فوائد,49000,"Azaiba, Muscat•",105,3,2,For Sale
تملك شقتك الفندقيه ف العذيبه بالاقساط علي 48 شهر بدون فوائد,29000,"Azaiba, Muscat•",60,2,1,For Sale
Own Your Shop with Residential Visa in installments over 8 years,39000,"Muscat Hills, Muscat•",15,3,3,For Sale
تملك محلك ف أول مول ف مسقط هيلز وبالاقساط علي 100 شهر بدون فوائد,39000,"Muscat Hills, Muscat•",15,3,3,For Sale
فيلا للبيع في الوادي الكبير مع الأثاث,165000,"Al Wadi Al Kabir, Muscat•",601,6,9,For Sale
محلات للبيع في الخوض مكان جميل جدا و ممتاز,40000,"Al Khoud, Muscat•",26,3,3,For Sale
فيلا للبيع في موقع مميز في المعبيله,79000,"Al Maabilah, Muscat•",600,5,3,For Sale
Twin villa in Athiba for sale / توين فيلا للبيع في العذيبه,168000,"Azaiba, Muscat•",700,6,7,For Sale
Villa for sale in Hail north فيلا للبيع في الحيل الشماليه,110000,"Al Hail, Muscat•",623,4,6,For Sale
توين فيلا جميلة للبيع في المسفاة,90000,"Misfah, Muscat•",312,7,5,For Sale
BRAND NEW 2 BHK PENTHOUSE FOR SALE !!,55000,"Ghala, Muscat•",103,3,2,For Sale
(freehold) 1bhk for sale in muscat hails,66000,"Muscat Hills, Muscat•",74,2,1,For Sale
للبيع ارض سكني تجاري بركاء (خرائط بناء مخزن معتمده),28000,"Barka, Al Batinah•",300,3,3,For Sale
للبيع بناية في دارسيت مؤجره بالكامل,185000,"Darsait, Muscat•",586,3,3,For Sale
شقق راقية للبيع في ولاية العامرات (بناية الميرا),28000,"Al Amarat, Muscat•",95,2,2,For Sale
للبيع ارض في المنى اول خط من الشارع الرئيسي جنب مسجد عبدالملك,115000,"Bosher, Muscat•",415,3,3,For Sale
Buying a villa with 10% down payment for 4 bedrooms,277000,"Yiti, Muscat•",285,6,4,For Sale
Modern Apartment for Sale in Muscat | شقة حديثة للبيع في مسقط,127000,"Yiti, Muscat•",120,3,2,For Sale
Amazing 1 BHK Apartment in Uptown |شقة غرفة وصالة في أب تاون ّFreeHold,59000,"Al Khoud, Muscat•",83,2,1,For Sale
Exclusive 2 BHK Marina View | شقة راقية في يتي - Sustainable City Yiti,166000,"Yiti, Muscat•",121,3,2,For Sale
Villa with 4 Bedrooms for Sale- فيلا بأربع غرف للبيع,517000,"Yiti, Muscat•",560,5,4,For Sale
Villa for Sale in Muscat- فيلا للبيع في مسقط,474000,"Yiti, Muscat•",500,5,4,For Sale
Golf View | Pool View 1 BHK Aida Greate Escape2 | 40 Month Installment,89000,"Yiti, Muscat•",56,2,1,For Sale
BOOK NOW Apartments in (SULTAN HAITHAM CITY) with 5 Years Payment Plan,53000,"Al Maabilah, Muscat•",67,1,1,For Sale
فيلا للبيع، مدينة السلطان هيثم Villa in Sultan Haitham City,227000,"Al Seeb, Muscat•",412,5,5,For Sale
1 BHK FreeHold Appartment uptow 15% down payment 44 Month Installment,72000,"Al Seeb, Muscat•",102,1,1,For Sale
شقة دوبلكس جديدة كليًا في العذيبة – موقع مميز  FSA83,58000,"Azaiba, Muscat•",103,3,2,For Sale
FREE HOLD!! Own your Town House at Wadi Zaha in Sultan Haitham City,176000,"Sultan Haitham City, Muscat•",220,5,3,For Sale
Fully Furnished 2BHK Apartment For Sale in Lagoon – Al Mouj FSA56,137000,"The Wave (Almouj), Muscat•",126,2,2,For Sale
Free Hold!! 95 sqm 1-Bedroom apartment for sale in Muscat Hills FSA45,63000,"Muscat Hills, Muscat•",95,2,1,For Sale
FREE HOLD!! Own a Studio at Yenaier in Sultan Haitham City,46000,"Sultan Haitham City, Muscat•",75,1,3,For Sale
Amazing 2BHK Corner Flat For Sale  in Muscat Hills FSA12,76000,"Muscat Hills, Muscat•",118,3,2,For Sale
Free Hold!! Own Your Fully Managed Holiday Home in AIDA,260000,"Yiti, Muscat•",125,3,3,For Sale
FREE HOLD!! Book your 2BHK apartment now in Wadi Zaha - SHC,70000,"Sultan Haitham City, Muscat•",110,3,2,For Sale
"1BHK Apartment FOR SALE in The BLV Tower, Muscat Hills",63000,"Muscat Hills, Muscat•",100,1,1,For Sale
Reduced Price!!! 2BHK Apartment with Pool View in Muscat Hills FSA43,70000,"Muscat Hills, Muscat•",100,2,2,For Sale
شقة للبيع في بناية شمس بوشر-Apartment for Sale (Shams Bousher Building,52000,"Bosher, Muscat•",112,2,2,For Sale
"For Sale – One-Bedroom Apartment in Marsa Garden, Al Mouj Muscat",110000,"The Wave (Almouj), Muscat•",95,1,1,For Sale
"تملك على البحر من 83,000 ريال (تملك حر) Own by the Beach",83000,"The Wave (Almouj), Muscat•",70,1,1,For Sale
For Sale: Prime Land in Ghala,3000,"Ghala, Muscat•",16,3,3,For Sale
Distress Sale Freehold 1 BHK with Residence Visa in Duqum for Just 22K,24000,"Al Duqum, Al Wusta•",40,2,1,For Sale
توين فيلا للبيع في حي الكوثر الخوض,118000,"Al Khoud, Muscat•",300,7,6,For Sale
منزل للبيع في المعبيلة الجنوبية حي العز,68000,"Al Maabilah, Muscat•",226,4,4,For Sale
Amazing 2+1BHK FOR SALE in AL Mouj – Luban FSA24,120000,"The Wave (Almouj), Muscat•",127,2,2,For Sale
Twin Villa for Sale Soor Al Hadid,87000,"Al Seeb, Muscat•",378,7,5,For Sale
Rare Opportunity – Marina View Apartment in Al Mouj at a Great Price,230000,"The Wave (Almouj), Muscat•",157,2,2,For Sale
شقة مؤثثة بالكامل للبيع بتصميم عصري VIP في المعبيلة 5 / 1 خلف عرب سويت,30000,"Al Maabilah, Muscat•",101,2,2,For Sale
شقة مؤثثة جزئيًا للبيع في المعبيلة قريب المدرسة الهندية على شارع النور,36000,"Al Maabilah, Muscat•",126,3,3,For Sale
منزل للبيع في المعبيلة الصناعية في حي العز خلف جامع السلطان تيمور,55000,"Al Maabilah, Muscat•",531,3,2,For Sale
شقة سكنية للبيع ف المعبيلة حي الرحبة قريب مدرسة منار الحكمة,25000,"Al Maabilah, Muscat•",101,3,3,For Sale
Sea View 1BHK Appartment FreeHold Installmentشقة بغرفة نوم واحدة للبيع,105000,"Yiti, Muscat•",78,2,1,For Sale
Last Chance| Courtyard Villa at The Sustainable City–Yiti | فيلا للبيع,236000,"Yiti, Muscat•",252,5,3,For Sale
شقة للبيع في مرتفعات المطار غلا – بسعر لا يفوت ابتداء من 26 ألف ريال,26000,"Ghala, Muscat•",60,2,1,For Sale
Villa fo sale with 3 bedrooms- فيلا للبيع بثلاث غرف نوم,238000,"Yiti, Muscat•",237,4,3,For Sale
Apartment in Muscat for Sale- شقة في مسقط للبيع,128000,"Yiti, Muscat•",120,3,2,For Sale
منزل مستقل للبيع في المعبيلة مقابل جامع السلطان تيمور بن فيصل,66000,"Al Maabilah, Muscat•",509,4,3,For Sale
فيلا بجودة بناء عالية للبيع في مرتفعات الأنصب,205000,"Ansab, Muscat•",405,6,4,For Sale
فيلا للبيع في الخوض السادسة,160000,"Al Khoud, Muscat•",300,7,6,For Sale
فيلا راقية للبيع في مرتفعات الأنصب Luxury vila for sale inAnsab hights,225000,"Ansab, Muscat•",704,9,7,For Sale
فلة مزرعة للبيع في منتجع السيفة,245000,"Al Sifah, Muscat•",1,5,4,For Sale
تملك شقتك في مسقط بالاقساط علي 100 شهر بدون فوائد,25000,"Al Maabilah, Muscat•",100,2,2,For Sale
تملك شقتك بقسط شهري 200 ريال ف مسقط,25000,"Al Maabilah, Muscat•",100,2,2,For Sale
3 Bedrooms Villa For Sale with Swimming Pool,320000,"The Wave (Almouj), Muscat•",269,3,3,For Sale
محل للبيع تجاري في موقع مميز وفرصة استثمارية عالية وفريدة,36000,"Ghala, Muscat•",44,3,3,For Sale
مكتب للبيع في موقع حيوي ومميز وبالقرب من كل الخدمات,48000,"Ghala, Muscat•",97,3,3,For Sale
محل للبيع تجاري في موقع استراتيجي وعائد استثماري عالي,28000,"Al Ghubrah, Muscat•",28,3,3,For Sale
Serviced 1 BHK Apartment | 3 Years Payment Plan | La Vie Residences,124000,"Muscat - Other, Muscat•",105,2,1,For Sale
Fully Serviced and Furnished Studio Apartment for Sale in La Vie,65000,"Muscat Hills, Muscat•",64,1,3,For Sale
1 BR Appartment | Sustainable City Yiti | شقة بغرفة نوم واحدة| ROI: 9%,79000,"Yiti, Muscat•",79,2,1,For Sale
شقة بغرفتي نوم 2 | الدفع بالتقسيط  في مدينة يتي المستدامة,127000,"Yiti, Muscat•",118,3,2,For Sale
FREE HOLD!! Amazing 2+1 Bedroom Apartment For Sale in AL Mouj,120000,"The Wave (Almouj), Muscat•",127,2,2,For Sale
ADS702***Brand New 1BHK Apartment for Sale – Prime Opportunity!,33000,"Bosher, Muscat•",80,2,1,For Sale
ADS701***Brand New 2BHK Apartment for Sale – Prime Opportunity!,43000,"Bosher, Muscat•",110,3,2,For Sale
ADS302**للبيع فيلا تشطيبات راقية في الخوض السابعة,135000,"Al Khoud, Muscat•",484,8,7,For Sale
Furnished Farm for Sale in Jebel Sifah with beautiful views,205000,"Al Sifah, Muscat•",177,3,3,For Sale
Own Your Apartment Now in Sultan Haitham City,54000,"Sultan Haitham City, Muscat•",67,1,1,For Sale
"تاون هاوس للبيع, مدينة السلطان هيثم | Townhouse Sultan Haitham City",111000,"Sultan Haitham City, Muscat•",194,3,3,For Sale
"Best Price 1 Bedroom Freehold Apartment for Sale Jebel Sifah, Muscat",50000,"Al Sifah, Muscat•",61,1,1,For Sale
"Zunairah Villas – Redefining Ultra-Luxury Living in Al Mouj, Muscat",4000,"The Wave (Almouj), Muscat•",2,7,7,For Sale
Luxury Lakefront Villa with Private Pool – Al Mouj,530000,"The Wave (Almouj), Muscat•",534,5,5,For Sale
Villa For Sale- 3 Bedroom Villa,254000,"Yiti, Muscat•",257,4,3,For Sale
مكاتب قيد الانشاء للبيع - المعبيلة| Off plan offices for sale,25000,"Al Maabilah, Muscat•",65,3,3,For Sale
Free Hold!! Own Your 1-Bedroom Apartment in Wadi Zaha - SHC,58000,"Al Seeb, Muscat•",75,2,1,For Sale
FREE HOLD!! Own your standalone villa in Wadi Zaha - SHC,340000,"Sultan Haitham City, Muscat•",388,6,4,For Sale
Spacious 4-Bedroom Farmhouse for Sale in Jebel Sifah,300000,"Al Sifah, Muscat•",1,4,4,For Sale
"2-Bedroom Apartment for Sale – Almeria North, Al Mouj Muscat",160000,"The Wave (Almouj), Muscat•",150,2,2,For Sale
"Luxury 1BR + Study with Sea View – Juman One, Al Mouj",120000,"The Wave (Almouj), Muscat•",104,1,1,For Sale
استخدم خدماتنا تساعدك في بيع عقارك/Sell ​​your property/free marketing,1000,"The Wave (Almouj), Muscat•",10,1,1,For Sale
Free Hold!! Furnished 1BHK Apartment with Pool View in Muscat Hills,72000,"Muscat Hills, Muscat•",78,2,1,For Sale
شقة ستوديو للبيع في واحة المعرفة | Studio with payment plan in Muscat,47000,"Al Khoud, Muscat•",57,1,1,For Sale
Luxurious 1 BHK Apartment for Sale in Yenaier - Sultan Haitham City,62000,"Sultan Haitham City, Muscat•",73,2,1,For Sale
"For Sale – Elegant Villa in Al Ghadeer Garden , Al Mouj Muscat",295000,"The Wave (Almouj), Muscat•",269,3,3,For Sale
For Sale | 2 Bed + Maid – Full Marina View | Al Mouj Muscat,265000,"The Wave (Almouj), Muscat•",181,2,2,For Sale
Modern 2BR + Study Apartment for Sale in Acacia,135000,"The Wave (Almouj), Muscat•",138,2,2,For Sale
شقة للبيع بمسقط هيلز Apartment for Sale in Muscat Hills,72000,"Muscat Hills, Muscat•",108,3,2,For Sale
Own your villa in wadi zaha -freehold for local and expats,154000,"Sultan Haitham City, Muscat•",209,3,3,For Sale
“Own Your Studio in Wadi Zaha –   100% Freehold for Expats & Locals,42000,"Sultan Haitham City, Muscat•",52,1,1,For Sale
Off- plan Apartments for Sale - Al Khoud | شقق قيد الإنشاء في الخوض,21000,"Al Khoud, Muscat•",53,2,1,For Sale
محل قيد الانشاء للبيع-المعبيلة  |Off- plan Shop for Sale-Almubilah,52000,"Al Maabilah, Muscat•",36,3,3,For Sale
شقق قيد الانشاء للبيع-المعبيلة  |Off- plan Apartments for Sale,17000,"Al Maabilah, Muscat•",55,2,1,For Sale
محل قيد الانشاء للبيع-بوشر |Off- plan Shop for Sale- Bushar,20000,"Bosher, Muscat•",21,3,3,For Sale
فيلا مستقلة للبيع,100000,"Al Khuwair, Muscat•",380,6,7,For Sale
بناية سكنية للبيع مؤجرة بالكامل,200000,"Al Ghubrah, Muscat•",1,3,3,For Sale
شقق فاخرة للبيع,48000,"Azaiba, Muscat•",118,3,2,For Sale
شقة بنتهاوس للبيع,35000,"Bosher, Muscat•",79,1,1,For Sale
فيلا حديثة الطراز بتشطيبات و مواصفات شخصية,85000,"Al Maabilah, Muscat•",322,7,5,For Sale
Live by the beach. Wake up to the marina. Own your place in luxury,78000,"The Wave (Almouj), Muscat•",70,1,1,For Sale
Villa for Sale with 4 BHK in Sultan Haitham City,340000,"Al Maabilah, Muscat•",380,4,4,For Sale
5 bedroom villa for sale in Muscat Bay,950000,"Qantab, Muscat•",646,5,5,For Sale
Villa for Sale in Salalah with 4 bedrooms,338000,"Salalah, Dhofar•",243,5,4,For Sale
"installments for 120 months,own your apmnt, office or shop,No upfront",35000,"Ghala, Muscat•",86,2,1,For Sale
Wonderful 1 BHK Apartment Sustainable City | Installment,85000,"Yiti, Muscat•",72,2,1,For Sale
"Gorgeous Sea View branded apartment, Feehold",470000,"The Wave (Almouj), Muscat•",203,3,2,For Sale
Hotel Apartment for Sale | Prime Sea View Location,599000,"The Wave (Almouj), Muscat•",262,5,3,For Sale
2BHK Apartment in AIDA |Great Escape 2–شراء شقة عايدة فقط 5٪ دفعة أولى,140000,"Yiti, Muscat•",95,3,2,For Sale
Villa for Sale with 4 BHK in Muscat Yiti,491000,"Yiti, Muscat•",384,4,4,For Sale
fully furnished villa in Muscat,269000,"Yiti, Muscat•",124,3,3,For Sale
6 Bedroom villa for sale in Al Mouj Muscat Jinan Island,1000,"The Wave (Almouj), Muscat•",907,7,6,For Sale
Villa for Sale with 4 Bedrooms,335000,"Salalah, Dhofar•",234,5,4,For Sale
Villa for Sale with 4 Bedrooms in Salalah,338000,"Salalah, Dhofar•",243,5,4,For Sale
Villa for Sale with 4 Bedrooms in Yiti,326000,"Yiti, Muscat•",286,6,4,For Sale
5 bedroom Villa for Sale in Muscat Bay,950000,"Qantab, Muscat•",750,6,5,For Sale
Villa for Sale with 4 Bedrooms - فيلا للبيع,340000,"Sultan Haitham City, Muscat•",140,6,4,For Sale
شقة دوبليكس غرفتين وصالة للبيع -مرتفعات غلا على إطلالة مميزة,55000,"Ghala, Muscat•",100,3,2,For Sale
Lovely 3 Bedroom apartment in Qurum for Sale,69000,"Qurum, Muscat•",138,5,3,For Sale
منزل للبيع المعبيلة الجنوبية مقابل الممشى والمنتزهات,89000,"Al Maabilah, Muscat•",388,7,8,For Sale
"‎شقة بدخل ٥سنوي -٦%، هوانا | Yearly 5-6% return apartment, Hawana",100000,"Salalah, Dhofar•",30,1,1,For Sale
شقق قيد الانشاء للبيع - الحيل | Off-Plan Apartments for Sale,23000,"Al Hail, Muscat•",64,2,1,For Sale
Apartment for Sale with 24 month Installment,77000,"Muscat Hills, Muscat•",104,3,2,For Sale
"Apartment for Sale, 24 Months Installment, Muscat Hills",95000,"Muscat Hills, Muscat•",129,3,2,For Sale
Apartment for Sale in Muscat Hills with 24 Months Installment,87000,"Muscat Hills, Muscat•",114,3,2,For Sale
Villa for Sale in Muscat Hills with pool,320000,"Muscat Hills, Muscat•",433,6,5,For Sale
Shop for Sale in Muscat Hills with Installment,170000,"Muscat Hills, Muscat•",103,3,3,For Sale
"Studio for Sale in Muscat, ITC, Off Plan, 3 Years Installment",9000,"Muscat Hills, Muscat•",49,1,3,For Sale
"Apartment for Sale in Muscat Hills, Off Plan, 36 Month Installment",12000,"Muscat Hills, Muscat•",81,2,1,For Sale
"Apartment for Sale in Golf Tower, Muscat Hills, Semi Furnished",79000,"Muscat Hills, Muscat•",130,3,2,For Sale
Villa for Sale with Installment in Muscat Hills,120000,"Muscat Hills, Muscat•",800,5,4,For Sale
Shop for Sale in Business Tower 2 Muscat Hills with installment,118000,"Muscat Hills, Muscat•",73,3,3,For Sale
Apartment for Sale with 1 BHK Furnished in Muscat Hills,78000,"Muscat Hills, Muscat•",108,2,1,For Sale
ADS902**4 BHK + 2 Maid's Room Villa for sales Beautiful Standalone Vi,470000,"Qurum, Muscat•",420,5,4,For Sale
1BHK Appartment in Aida Great Escape2-- 5 % downpayment شراء شقة عايدة,90000,"Yiti, Muscat•",57,2,1,For Sale
Sea View | Furnished Beachfront 2BHK Villa| Private Pool | Jebel Sifah,265000,"Al Sifah, Muscat•",139,3,2,For Sale
FREE HOLD!! Own your  villa in Sultan Haitham City,340000,"Sultan Haitham City, Muscat•",388,6,4,For Sale
Canal View | Big Terrace | Furnished Corner 2BHK Apartment in Al Mouj,140000,"The Wave (Almouj), Muscat•",126,2,2,For Sale
Own Golf View Villa Today!  اغتنم شراء فیلا| تقسیط | مطلة على الجولف,437000,"The Wave (Almouj), Muscat•",314,5,4,For Sale
2 Bedrooms Apartment for Sale With Marina Views,220000,"The Wave (Almouj), Muscat•",153,2,2,For Sale
2 Bedroom Apartment for Sale in Almeria North Wave Muscat Almouj,125000,"The Wave (Almouj), Muscat•",139,2,2,For Sale
Offices for Sale – Freehold for Foreigners in Prime Location,1000,"Muscat Hills, Muscat•",70,3,3,For Sale
للبيع اراضي في الرميس مخطط حي المعمورة,19000,"Barka, Al Batinah•",600,3,3,For Sale
للبيع ارض سكني تجاري في الرميس,38000,"Barka, Al Batinah•",431,3,3,For Sale
Apartment for Sale in Bawshar - شقة للبيع في بوشر,53000,"Bosher, Muscat•",108,3,2,For Sale
Freehold Ready 3BR Nameer Villa | Life-Time Residency | Muscat Bay,396000,"Muscat - Other, Muscat•",426,5,3,For Sale
Sea View | 5BR Wajd Villa | Life-Time Oman Residency | Muscat Bay,950000,"Muscat - Other, Muscat•",750,7,5,For Sale
Waterfront 5BR Wajd Villa | Life-Time Oman Residency | Muscat Bay,1000,"Muscat - Other, Muscat•",760,7,5,For Sale
Freehold Ready 1BR | Luxury Waterfront Lifestyle in Muscat Bay,103000,"Muscat - Other, Muscat•",79,1,1,For Sale
Lavish Resort Living | Life-Time Oman Residency | Muscat Bay,98000,"Muscat - Other, Muscat•",79,1,1,For Sale
Discounted Price | Freehold Ready Studio in Muscat Bay,72000,"Muscat - Other, Muscat•",60,1,3,For Sale
1bedroom for sale Sultan haitham city- غرف للبيع مدينة السلطان هيثم,58000,"Sultan Haitham City, Muscat•",70,2,1,For Sale
"ADA301**Own your apartment in Uptown Muscat,1 BHK Starting From 40,000",40000,"Al Khoud, Muscat•",38,1,1,For Sale
Luxury villa for sales in Muscat Hills,390000,"Muscat Hills, Muscat•",450,5,4,For Sale
مزرعة مفروشة بالكامل للبيع في مشروع حي النسيم بركاء,210000,"Barka, Al Batinah•",4,3,3,For Sale
للبيع توين فيلا في حالة ممتازة للبيع في الانصب قريب من الحديقة الانصب,145000,"Ansab, Muscat•",350,5,4,For Sale
Fully Furnished 3BHK Villa in AIDA Sunrise Haven with Payment Plan,198000,"Yiti, Muscat•",124,4,3,For Sale
Land For Sale - Adjacent to Almouj Golf Course أرض للبيع مجاورة للموج,10000,"The Wave (Almouj), Muscat•",16,3,3,For Sale
Sea View | FullyFurnished 1BHK Apt Juman2 in AlMouj شقة مطلة على البحر,135000,"The Wave (Almouj), Muscat•",106,2,1,For Sale
Boulevard View | Terrace | 20/80 Payment Plan | Hay Alwafa,55000,"Sultan Haitham City, Muscat•",67,2,1,For Sale
GHALA | 2738 SQM WAREHOUSE WITH STAFF ACCOMODATION,800000,"Ghala, Muscat•",2,3,3,For Sale
شقة غرفة واحدة للبيع الموج لاجون - 1BHK apartment for sale almouj,94000,"The Wave (Almouj), Muscat•",107,2,1,For Sale
شقة اطلالة بحرية للبيع في الموج sea view apartment for sale in Al Mouj,141000,"The Wave (Almouj), Muscat•",127,2,2,For Sale
Sea View-1BHK Appartment Sustainable City Yiti | شراء شقة |Urgent Sale,105000,"Yiti, Muscat•",78,2,1,For Sale
استثمار مربح /موج مسقط /عوائد سنویة /تملک حر,425000,"The Wave (Almouj), Muscat•",619,6,5,For Sale
اسرع مطور |مباشرة من المالک |محلات تجاریة للبیع | الموالح |,19000,"Al Mawaleh, Muscat•",23,3,3,For Sale
"شقة للبيع بمزايا فريدة وموقع استراتيجي ,اختيارك للسكن او الإستثمار",45000,"Ghala, Muscat•",106,3,2,For Sale
Exclusive Beachfront 2 bedrooms Villa in Jebel Sifah,205000,"Al Sifah, Muscat•",129,2,2,For Sale
Marina View -2BHK FreeHold Appartment Sustainable City Yiti | شراء شقة,166000,"Yiti, Muscat•",121,3,2,For Sale
Sea View Garden Villa 4+1 BHK - 7 Years Installment | 10% Downpayments,595000,"Yiti, Muscat•",501,6,4,For Sale
منزل للبيع المعبيله الجنوبية قريب من حي الزعفران,95000,"Al Maabilah, Muscat•",630,4,4,For Sale
